{
  "xinka_version": "0.1",
  "card_type": "knowledge",
  "claim": "Python 编程语言由荷兰程序员 Guido van Rossum 创建：实现始于 1989 年 12 月，1991 年 2 月首次公开发布（Python 0.9.0），其命名源自蒙提·派森喜剧团。",
  "source_url": "https://docs.python.org/3/faq/general.html",
  "collected_at": "2026-10-01T10:40:00Z",
  "trust_level": "verified",
  "freshness_until": "2027-10-01T00:00:00Z",
  "position": "tech/programming/python-origin",
  "verification": {
    "method": "three-source cross-check",
    "sources": [
      "https://docs.python.org/3/faq/general.html",
      "https://en.wikipedia.org/wiki/Python_(programming_language)",
      "https://wiki.python.org/moin/Guido(20)van(20)Rossum.html"
    ],
    "checked_at": "2026-10-01T12:40:00Z"
  }
}